{"link": "https://vnexpress.net/tu-thien-vi-ai-4261899.html", "title": null, "description": null, "content": "", "category": "Góc nhìn", "pub_date": 1618237516.0, "keywords": ["Góc nhìn", "VnExpress", "từ thiện", "văn hóa từ thiện", "giảm nghèo", "văn hóa chia sẻ", "vốn xã hội", "giáo dục đức hạnh", "vì cộng đồng", "cứu trợ miền Trung"], "tags": ["góc nhìn", "vnexpress", "từ thiện", "văn hóa từ thiện", "giảm nghèo", "văn hóa chia sẻ", "vốn xã hội", "giáo dục đức hạnh", "vì cộng đồng", "cứu trợ miền trung"]}
{"link": "https://vnexpress.net/thi-diem-xe-dap-cong-cong-o-trung-tam-sai-gon-tu-thang-8-4261857.html", "title": "Thí điểm xe đạp công cộng ở trung tâm Sài Gòn từ tháng 8", "description": "Xe đạp công cộng triển khai ở các tuyến đường quận 1 từ tháng 8 năm nay, giá thuê mỗi chiếc 5.000 đồng trong 30 phút, 10.000 đồng một giờ.", "content": "Thông tin được ông Đỗ Bá Dân, Chủ tịch Hội đồng quản trị Tập đoàn Trí Nam (nhà đầu tư) cho biết chiều 12/4, sau khi UBND TP HCM đồng ý thí điểm xe đạp công cộng Mobike tại quận 1 trong một năm. Quá trình triển khai, Sở Giao thông Vận tải sẽ tính toán, điều chỉnh linh hoạt số lượng xe, phạm vi, tổng kết và đánh giá kết quả.\nHiện, Tập đoàn Trí Nam đẩy nhanh hoàn tất thủ tục, mua sắm thiết bị, nhập khẩu xe, đánh giá độ bền, tính năng khóa thông minh, sự thuận tiện để thực hiện lâu dài. Chủ đầu tư lên kế hoạch nhập 500 chiếc để triển khai, dự phòng, đảm bảo việc thí điểm hiệu quả. Mỗi xe chi phí dự tính 10 triệu đồng.\nTrước đó, Sở Giao thông Vận tải thành phố đề xuất thí điểm đầu tư 388 xe bố trí ở 43 vị trí tại khu vực quận 1 và dọc dự án tổ chức làn ưu tiên cho xe buýt trên đường Điện Biên Phủ, Võ Thị Sáu (quận 3).\nXe đạp sử dụng là loại gắn khóa thông minh, có tính năng định vị GPS, đóng hoặc mở khóa thông qua kết nối mạng 2G, 3G, 4G hoặc bluetooth trên di động. Người dùng cài đặt ứng dụng Mobike trên điện thoại rồi quét xung quanh, tìm trạm có xe đạp gần nhất. Sau đó, khách dùng ứng dụng này quét mã code mở khóa xe. Khi hoàn tất chuyến đi, người dùng đậu xe vào đúng nơi quy định.\nMỗi khách hàng sẽ được đăng ký một tài khoản và kết nối thanh toán trên ứng dụng di động hoặc website thông qua các hình thức: thẻ tín dụng, ATM; tài khoản ngân hàng; chuyển khoản hoặc nạp tiền trực tiếp tại trung tâm quản lý...\nĐể tránh xảy ra mất cắp, thất lạc, người dùng đăng ký dịch vụ cần cung cấp và xác minh thông tin cá nhân hợp lệ. Mỗi xe đạp được gắn thẻ ID định danh. Thông qua hệ thống phần mềm trung tâm, nhân viên vận hành có thể theo dõi lộ trình di chuyển của xe và người điều khiển.\nHệ thống xe đạp này được bố trí trên vỉa hè một số tuyến đường trung tâm tại quận 1, gần các điểm dừng xe buýt (trạm dừng, nhà chờ) lưu lượng lớn. Điều này đảm bảo người dân có thể đi bộ, tiếp cận dịch vụ thuận lợi. Mỗi trạm có diện tích 10-15 m2, cho 10-20 xe đậu hai dãy, bề rộng tối thiểu cho một xe là một mét.\nTheo Sở Giao thông Vận tải, mạng lưới xe đạp giúp kết nối người dân đến trạm xe buýt thuận tiện hơn thay vì đi bộ như hiện tại. Trong bối cảnh thành phố đang nghiên cứu thí điểm 2 tuyến đường ưu tiên cho xe buýt, xe đạp công cộng được cho là phương án hiệu quả để gom khách.\nViệc mở dịch vụ cho thuê xe đạp công cộng ở trung tâm TP HCM được nhiều đơn vị quan tâm. Năm 2018, một doanh nghiệp thử nghiệm xe đạp thông minh E-bike tại Đại học Quốc gia TP HCM (TP Thủ Đức) nhưng đã ngưng.\nGia Minh - Hữu Công", "category": "Giao thông", "pub_date": 1618268400.0, "keywords": ["xe đạp công cộng", "xe đạp", "vỉa hè", "xe buýt", "Giao thông", "Tin", "Tin nóng"], "tags": ["xe đạp công cộng", "xe đạp", "vỉa hè", "xe buýt"]}
{"link": "https://vnexpress.net/who-ca-covid-19-dang-tang-theo-cap-so-nhan-4261937.html", "title": "WHO: Ca Covid-19 đang tăng theo cấp số nhân", "description": "Thế giới ghi nhận hơn 137 triệu ca nhiễm, gần ba triệu người chết do nCoV, WHO cảnh báo ca nhiễm tăng theo cấp số nhân, bất chấp nỗ lực ngăn chặn.", "content": "Thế giới đã ghi nhận 137.218.311 ca nhiễm nCoV và 2.957.223 ca tử vong, tăng lần lượt 608.718 và 8.642, trong khi 110.323.952 người đã bình phục, theo trang thống kê thời gian thực Worldometers.\n\"Chúng ta hiện trong thời điểm quan trọng của đại dịch. Quỹ đạo của đại dịch đang phát triển theo cấp số nhân\", Maria Van Kerkhove, trưởng nhóm kỹ thuật của Tổ chức Y tế Thế giới (WHO) về Covid-19, hôm 12/4 cho biết.\n\"Đây không phải là tình huống chúng tôi chờ đợi trong 16 tháng kể từ khi đại bùng phát, dù chúng tôi đã chứng minh được các biện pháp kiểm soát\", bà nói thêm. \"Đây là lúc mọi người phải xem xét tình huống cẩn thận và kiểm tra thực tế xem chúng ta cần phải làm gì. Vaccine và tiêm chủng đang có sẵn, nhưng không phải ở mọi nơi trên thế giới\".\nBà Kerkhove cho biết ca Covid-19 tăng 9% trên toàn cầu, đánh dấu tuần tăng thứ bảy liên tiếp, trong khi ca tử vong tăng 5%. Bà kêu gọi các chính phủ hỗ trợ công dân của họ thực hiện biện pháp an toàn trong đại dịch.\nTiến sĩ Mike Ryan, người đứng đầu chương trình khẩn cấp y tế của WHO, nói rằng virus này đang \"mạnh hơn, nhanh hơn\" với sự xuất hiện của các biến thể mới dễ lây lan hơn và gây tử vong cao hơn so với chủng virus ban đầu . \"Tất cả chúng ta đều đang phải vật lộn với và chán nản với những biện pháp phong tỏa, hạn chế\", ông nói.\nMỹ, vùng dịch lớn nhất thế giới, báo cáo 31.981.587 ca nhiễm và 576.273 ca tử vong do nCoV, tăng 50.274 ca nhiễm và 435 ca tử vong so với một ngày trước đó.\nGần 175 triệu liều vaccine đã được tiêm tại Mỹ từ khi chiến dịch tiêm chủng bắt đầu tháng 12 năm ngoái. Hơn 112 triệu người Mỹ, tức hơn một phần ba dân số, đã tiêm ít nhất một liều vaccine ngừa Covid-19.\nTính tới ngày 8/4, gần 20% người Mỹ đã nhận đủ hai mũi tiêm vaccine ngừa Covid-19. Tập đoàn Pfizer ngày 9/4 cho biết đang xin chính phủ Mỹ cấp phép tiêm vaccine cho trẻ 12-15 tuổi và có kế hoạch đưa ra đè xuất tương tự với các cơ quan quản lý khác trên toàn thế giới trong những ngày tới.\nẤn Độ là vùng dịch lớn thứ hai thế giới với 13.525.364 ca nhiễm và 170.209 ca tử vong, tăng so với hôm trước lần lượt 169.899 và 904 ca.\nĐợt bùng phát dịch thứ hai có tốc độ lây lan nhanh hơn so với đợt dịch đầu tiên hồi giữa năm ngoái, buộc nhiều bang áp dụng các biện pháp phong tỏa ngặt nghèo. Maharashtra, bang giàu có nhất của Ấn Độ và hiện là tâm dịch, đã áp đặt chế độ phong tỏa cuối tuần và lệnh giới nghiêm ban đêm.\nTuy nhiên, Thủ tướng Narendra Modi chưa ra lệnh phong tỏa toàn quốc vì lo ngại thiệt hại kinh tế quá lớn.\nChính phủ Ấn Độ cho rằng dịch bùng phát trở lại do tình trạng tập trung đông người và không đeo khẩu trang kể từ khi các doanh nghiệp được hoạt động trở lại từ tháng 2. Nhiều bang đã lên tiếng về tình trạng thiếu vaccine, dù chương trình tiêm chủng hiện nay chỉ áp dụng cho khoảng 400 triệu trong tổng số 1,35 tỷ người dân Ấn Độ.\nBrazil là vùng dịch lớn thứ ba thế giới với 13.517.808 ca nhiễm và 354.617 ca tử vong, tăng lần lượt 35.265 và 1.324.\nBrazil đang phải trải qua đợt bùng phát Covid-19 mới, khiến các bệnh viện trên cả nước đều sắp bị quá tải. Quốc gia Nam Mỹ này cũng đang vật lộn để đảm bảo đủ vaccine cho dân số 212 triệu người.\nBất chấp ca nhiễm gia tăng, Tổng thống Jair Bolsonaro tiếp tục phản đối phong tỏa và các biện pháp hạn chế khác, đồng thời chỉ trích thống đốc và thị trưởng vì đã thực hiện chúng. Tòa án Tối cao Brazil hôm 8/4 yêu cầu Thượng viện mở cuộc điều tra cách chính phủ Bolsonaro xử lý đại dịch. Tổng thống Brazil sau đó lên tiếng phê phán cuộc điều tra, cho rằng đây là nỗ lực làm suy yếu chính phủ.\nPháp, vùng dịch lớn thứ tư thế giới và lớn nhất châu Âu, ghi nhận 5.067.216 ca nhiễm và 99.135 ca tử vong.\nTất cả các nhà hàng và quán cà phê ở Pháp đã bị đóng cửa 5 tháng qua. Pháp tuần này bắt đầu một đợt phong tỏa, hạn chế mới trên toàn quốc để đối phó tình trạng ca Covid-19 gia tăng.\nViệc mở rộng triển khai vaccine đã mang lại sự lạc quan cho những người dân đã mệt mỏi vì phong tỏa. Tất cả người trên 55 tuổi hiện đủ điều kiện để tiêm vaccine.\nAnh, báo cáo 4.373.343 người nhiễm và 127.100 người chết, tăng lần lượt 3.568 và 13 trường hợp.\nCác nhà khoa học tại trường University College London (UCL) dự báo Anh có thể đạt ngưỡng quan trọng khi tỷ lệ người \"an toàn\" trước virus nhờ tiêm chủng, từng bị nhiễm hoặc miễn dịch tự nhiên đạt 73,4% vào ngày 12/4.\nAnh, một trong những quốc gia có tỷ lệ tử vong do Covid-19 cao nhất thế giới, vẫn có tia hy vọng khi hôm 12/4, các quán rượu và nhà hàng được phép phục vụ ngoài trời. \"Thật tuyệt khi gặp lại mọi người và gặp lại tất cả người dân địa phương\", Louise Porter, chủ quán ở Askrigg, miền bắc nước Anh, nói. \"Cuộc sống của chúng tôi vừa bị đảo lộn, giống như mọi người khác\".\nCác tiệm làm tóc, phòng tập thể hình và bể bơi của Anh cũng được bật đèn xanh để mở cửa trở lại.\nTừng là quốc gia bị ảnh hưởng nặng nề nhất ở châu Âu, Anh đã khởi động một chiến dịch tiêm chủng thành công cùng với các biện pháp ngăn chặn, giúp giảm 95% ca tử vong và 90% ca bệnh từ tháng 1.\nTại Đông Nam Á, Indonesia là vùng dịch lớn nhất khu vực với 1.571.824 ca nhiễm, tăng 4.829, trong đó 42.656 người chết, tăng 126.\nJakarta cảnh báo 100 triệu liều vaccine AstraZeneca có thể không được chuyển giao cho Indonesia đúng hạn, do những hạn chế xuất khẩu ở Ấn Độ. Jakarta có kế hoạch đầy tham vọng là tiêm chủng 181 triệu trong tổng số gần 270 triệu dân trong vòng một năm, chủ yếu dựa vaccine Sinovac của Trung Quốc và vaccine AstraZeneca.\nQuốc gia Đông Nam Á này đã tiêm chủng ít nhất 13,5 triệu liều. Khoảng 4,43 triệu người, chiếm 1,6% dân số, đã hoàn thành chương trình tiêm chủng.\nPhilippines vùng dịch lớn thứ hai Đông Nam Á, ghi nhận 876.225 ca nhiễm và 15.149 ca tử vong, tăng lần lượt 11.378 và 204 ca.\nPhilippines đã đình chỉ tiêm vaccine AstraZeneca cho người dưới 60 tuổi sau các báo cáo về tình trạng đông máu ở nhiều nước, khiến chiến dịch tiêm chủng vaccine chống Covid-19 của nước này bị đình trệ.\nPhilippines đã nhận được khoảng 2,5 triệu liều vaccine Covid-19, phần lớn từ công ty Sinovac của Trung Quốc. Họ cũng nhận được 525.600 liều AstraZeneca thông qua chương trình Covax, hầu hết đã được tiêm. Nước này dự kiến nhận thêm ba triệu liều AstraZeneca trong những tháng tới.\nCampuchia ghi nhận thêm 277 ca nhiễm nCoV và một ca tử vong, nâng tổng số người mắc Covid-19 lên 4.515, trong đó 30 người đã tử vong. Phần lớn ca nhiễm gần đây ở Campuchia là công nhân may mặc và tiểu thương ở chợ.\nĐại diện WHO tại Campuchia Li Ailan cảnh báo nước này đang \"đứng bên bờ vực thảm kịch quốc gia\" do Covid-19. \"Ca nhiễm mới được ghi nhận hàng ngày và chúng tôi đang chạy đua với virus. Hệ thống y tế Campuchia có nguy cơ vỡ trận và gây hậu quả thảm khốc nếu không thể chặn được đợt bùng phát\", bà cho hay.\nCa nhiễm tại Campuchia tăng mạnh từ cuối tháng 2 khi một ổ dịch được phát hiện trong cộng đồng người Trung Quốc ở nước này. Các bệnh viện ở thủ đô Phnom Penh sắp quá tải và giới chức đang chuyển đổi trường học, hội trường tiệc cưới thành trung tâm điều trị cho những bệnh nhân gặp triệu chứng nhẹ.\nHuyền Lê (Theo AFP, CNBC)", "category": "Thế giới", "pub_date": 1618270586.0, "keywords": ["Covid-19", "Covid-19 toàn cầu", "WHO", "ca Covid-19", "ca tử vog do Covid-19", "Chính trị xã hội thế giới", "Tin", "Tin nóng"], "tags": ["covid-19", "covid-19 toàn cầu", "who", "ca covid-19", "ca tử vog do covid-19"]}
{"link": "https://vnexpress.net/gia-chung-cu-ha-noi-van-tang-4261847.html", "title": "Giá chung cư Hà Nội vẫn tăng", "description": "Quý I, giá bán nhà trên thị trường sơ cấp tại Hà Nội được ghi nhận trung bình 1.461 USD một m2, tăng 7% theo năm và 3% theo quý.", "content": "Báo cáo thị trường nhà ở TP Hà Nội của CBRE cho biết, trong 3 tháng qua, nguồn cung căn hộ bán tiếp tục dồn về phân khúc trung cấp, trong khi hạn chế từ các phân khúc còn lại. Mức biến động giá của các phân khúc khác phụ thuộc nhiều vào mặt bằng giá các dự án mới mở bán.\nDo các dự án mở bán mới trong quý này ở vị trí đắc địa hơn các dự án bán giai đoạn trước, mức giá phân khúc cao cấp và bình dân tăng lần lượt 9% và 5% theo quý.\nTrên thị trường thứ cấp, một số dự án cao cấp mới hoàn thiện gần đây tại các khu vực dân cư đã phát triển như Ba Đình, Cầu Giấy, Nam Từ Liêm tăng giá 3-7% theo năm. Trong khi đó, mức giá trung bình của cả khu vực (bao gồm các dự án đã hoàn thiện từ lâu) chỉ dao động 1-3% theo năm.\nBên cạnh đó, dự án nằm gần các khu vực có công trình hạ tầng sắp hoàn thiện như dọc đường vành đai 2 trên cao hay khu vực có những thông tin tích cực về quy hoạch như tại khu vực quận Long Biên giá tăng từ 5-9% theo năm. Giá bán trung bình trên thị trường sơ cấp dự kiến tăng 4-6% trong năm 2021, theo CBRE.\nJLL Việt Nam cũng đưa ra nhận định tương tự khi cho biết giá bán căn hộ tại Hà Nội vẫn được dự báo tăng. Tuy nhiên, đơn vị này cho biết, xu hướng tăng giá đang chậm lại. Mức tăng trưởng giá ghi nhận tốc độ tăng chậm hơn so với quý trước, giá bán sơ cấp trung bình đạt 1.555 USD một m2 trong quý I.\nMặt khác, theo JLL, dù giá bán niêm yết tại các dự án không có dấu hiệu giảm, các chủ đầu tư để cải thiện hiệu suất bán hàng vẫn liên tục đưa ra các chương trình ưu đãi như: gói hỗ trợ lãi suất 0%, chiết khấu dịp cuối năm và kéo dài thời hạn thanh toán cho phép khách mua ở trước trả sau. Hiện tượng này xảy ra rõ rệt hơn ở phân khúc cao cấp từ năm ngoái và tiếp tục diễn ra trong 3 tháng đầu năm.\nJLL cũng thông tin, nguồn cung dự báo tiếp tục được cải thiện cho đến cuối năm 2021, dao động khoảng 20.000-25.000 căn, chủ yếu đến từ phân khúc giá rẻ. Con số này với CBRE là 24.000-26.000 căn. Các dự báo đều cho thấy trong các quý tới, thị trường sẽ có nhiều dự án nhà ở và khu đô thị mở bán trên nhiều khu vực khác nhau giúp cho thị trường sôi động hơn.\n\"Nguồn cầu mua nhà để ở dự kiến tiếp tục giữ mức ổn định.Thị trường căn hộ cho thuê ở các dự án cao cấp kỳ vọng sẽ được cải thiện khi các đường bay quốc tế nối lại trong quý II\", JLL cho biết.\nĐức Minh ", "category": "Bất động sản", "pub_date": 1618254000.0, "keywords": ["mua chung cư hà nội", "giá chung cư", "giá nhà", "Giá cả thị trường hàng hoá - tài sản", "Tin", "Tin nóng"], "tags": ["mua chung cư hà nội", "giá chung cư", "giá nhà"]}
{"link": "https://vnexpress.net/so-sanh-muc-do-o-nhiem-cua-oto-dien-voi-xe-xang-4257021.html", "title": "So sánh mức độ ô nhiễm của ôtô điện với xe xăng", "description": "Nếu các xe chạy xăng, dầu phát thải CO2 trong quá trình sử dụng thì các mẫu xe điện hóa phát thải sẽ ở trong quá trình sản xuất.", "content": "Xe điện cũng phát thải CO2, nhưng không phải trong quá trình sử dụng, mà là khi sản xuất điện - đây là lý do mà nhiều ý kiến cho rằng dòng xe này không hoàn toàn sạch thuần khiết. Thậm chí, chủ tịch Toyota từng gay gắt cho rằng xe điện đang bị thổi phồng quá mức.\nTrên thực tế các loại xe điện hóa gồm Hybrid (HEV), Plug-in Hybrid (PHEV) vẫn thải CO2 cả khi sử dụng (vì vẫn có động cơ đốt trong) và có thể khi sản xuất điện, tùy thuộc cách tạo ra điện. Trong khi xe thuần điện chỉ có thể tạo ra CO2 trong quá trình sản xuất, không thải ra khi sử dụng.\nTùy thuộc vào nguồn tạo ra điện là thủy điện, phong điện hay nhiệt điện, điện hạt nhân... mà lượng tạo ra CO2 sẽ khác nhau. Nếu thủy điện thì mức CO2 gần như bằng 0, trong khi nhiệt điện lại quá nhiều CO2.\nNghiên cứu của Bloomberg NEF tại Thái Lan cho thấy, xe điện tạo ra lượng CO2 bằng 60% so với một chiếc xe xăng tương đương. Nguồn CO2 này hoàn toàn đến từ sản xuất, bởi Thái Lan tạo ra điện chủ yếu từ khí gas tự nhiên. Trong khi xe động cơ đốt trong tạo ra CO2 theo tỷ lệ 80/20 giữa sử dụng và sản xuất.\nVí dụ: nếu một chiếc xe xăng tạo ra 100 g CO2/km 80 g từ sử dụng còn 20 g từ sản xuất xăng. Trong khi một mẫu xe điện tương ứng chỉ tạo ra 60 g CO2 từ sử dụng. Như vậy, xe điện vẫn sạch hơn xe xăng đáng kể.\nNếu tại Việt Nam, xe điện sẽ sạch hơn đáng kể vì nguồn tạo ra điện có thể thải CO2 thấp hơn. Cụ thể như bảng dưới đây, trong đó than đá, dầu mỏ, khí gas tự nhiên là những nguồn tạo ra điện đồng thời tạo ra CO2, còn lại hạt nhân, thủy điện, năng lượng tái tạo và các nguồn khác không tạo CO2.\nVới các nước có nguồn sản xuất điện sạch như Na Uy, tới 95% năng lượng điện đến từ thủy điện thì lượng phát thải CO2 còn thấp hơn nữa. Tương lai về các mẫu xe điện đang dần trở nên rõ rệt khi có càng nhiều hãng xe tham gia vào việc sản xuất và nghiên cứu xe điện. Người dùng thường không quá quan tâm tới lượng phát thải CO2 trong sản xuất, mà nhận ra ngay khi sử dụng sẽ giúp nơi xe lưu hành ít ô nhiễm hơn.\nĐối với các nhà sản xuất xe điện việc tạo và duy trì nguồn năng lượng điện sẽ quan trọng không kém việc xây dựng hạ tầng trạm sạc. Cũng giống như nhiên liệu đốt trong, việc đảm bảo an toàn nguồn cung ứng năng lượng cũng là vấn đề rất được lưu tâm, từ góc độ quản lý vĩ mô chứ không chỉ câu chuyện kinh doanh của các hãng.\nĐoàn Dũng", "category": "Xe điện", "pub_date": 1618217755.0, "keywords": ["oto điện", "Công nghệ xe", "Phân tích", "Tin nóng"], "tags": ["oto điện", "công nghệ xe"]}
{"link": "https://vnexpress.net/ha-noi-cho-phep-doi-khu-vuc-tuyen-sinh-vao-lop-10-4261850.html", "title": "Hà Nội cho phép đổi khu vực tuyển sinh vào lớp 10", "description": "Học sinh vùng giáp ranh, hoặc chỗ ở thực tế khác với nơi đăng ký hộ khẩu thường trú được đổi khu vực tuyển sinh vào lớp 10, theo Sở Giáo dục và Đào tạo Hà Nội.", "content": "Ngày 12/4, Sở Giáo dục và Đào tạo Hà Nội công bố hướng dẫn tuyển sinh vào lớp 10 THPT năm học 2021-2022, văn bản được phụ huynh chờ đợi suốt từ khi Sở ban hành kế hoạch tuyển sinh vào lớp 10 công lập hồi tháng 2.\nTheo hướng dẫn này, năm nay toàn thành phố vẫn chia làm 12 khu vực tuyển sinh như mọi năm. Học sinh được đăng ký dự tuyển tối đa vào ba trường THPT công lập, xếp theo thứ tự ưu tiên từ 1 đến 3. Trong đó, nguyện vọng 1 và 2 phải vào trường THPT thuộc khu vực tuyển sinh mà học sinh hoặc bố, mẹ có hộ khẩu thường trú, nguyện vọng 3 vào trường ở khu vực bất kỳ.\nHọc sinh thuộc vùng giáp ranh giữa các khu vực tuyển sinh hoặc có chỗ ở thực tế khác với nơi đăng ký hộ khẩu thường trú được phép đổi khu vực với điều kiện là nguyện vọng 1 và 2 phải đăng ký dự tuyển vào hai trường trong cùng khu vực đã thay đổi, nguyện vọng còn lại (nếu có) thuộc khu vực bất kỳ.\nHọc sinh muốn đổi cần có đơn (theo mẫu của Sở), trong đó nêu rõ lý do đổi. Đơn này phải được hiệu trưởng các trường THCS nơi học sinh theo học xác nhận. Như vậy, quy định về đổi khu vực tuyển sinh năm nay về cơ bản không có thay đổi gì so với năm trước.\nCũng theo văn bản hướng dẫn, học sinh đăng ký dự tuyển vào các trường THPT chuyên hoặc THPT có lớp chuyên, THPT công lập tự chủ tài chính và trường ngoài công lập thì không phải tuân theo quy định về khu vực tuyển sinh.\nKỳ thi vào lớp 10 THPT công lập ở Hà Nội sẽ diễn ra ngày 10-11/6. Thí sinh làm bốn bài thi gồm Toán, Ngữ văn, Ngoại ngữ và Lịch sử. Điểm xét tuyển sẽ được tính bằng tổng điểm Toán và Ngữ văn nhân hệ số 2, cộng với điểm Ngoại ngữ, Lịch sử và điểm ưu tiên.\nTrước đó giữa tháng 2, nhiều phụ huynh lo lắng đến mất ăn mất ngủ sau khi Hà Nội ban hành kế hoạch tuyển sinh vào lớp 10 năm học 2021-2021, trong đó nêu học sinh được đăng ký 3 nguyện vọng nhưng nguyện vọng 1 và 2 phải vào trường thuộc khu vực tuyển sinh mà các em có hộ khẩu thường trú. Thay đổi này khiến nhiều thí sinh mất cơ hội vào những trường mong muốn.\nNgày 21/2, sau khi nhận được phản ánh, ông Phạm Văn Đại, Phó giám đốc Sở Giáo dục và Đào tạo Hà Nội, khẳng định Sở đã tính toán kỹ lưỡng khi đưa ra quy định, tuy nhiên vẫn sẽ tạo điều kiện cho học sinh thi vào lớp 10 trường công lập đổi khu vực tuyển sinh theo nơi cư trú thực tế.\nNăm nay, kỳ thi tuyển sinh vào lớp 10 THPT công lập ở Hà Nội dự kiến có sự tham gia của gần 91.000 học sinh. Trong đó, khoảng 62% được tuyển vào các trường THPT công lập, 22% vào trường ngoài công lập và trường THPT công lập tự chủ tài chính, 8% vào trung tâm Giáo dục nghề nghiệp - Giáo dục thường xuyên và 8% tham gia học nghề.\n>>Xem chi tiết hướng dẫn", "category": "THPT", "pub_date": 1618225649.0, "keywords": ["thi vào lớp 10 ở Hà Nội", "khu vực tuyển sinh", "Tin nóng", "Tuyển sinh", "Tin"], "tags": ["thi vào lớp 10 ở hà nội", "khu vực tuyển sinh"]}
