{"link": "https://vnexpress.net/hoa-hau-hoan-vu-an-do-mac-covid-19-4261910.html", "title": "Hoa hậu Hoàn vũ Ấn Độ mắc Covid-19", "description": "Adline Castelino - Hoa hậu Hoàn vũ Ấn Độ - cho biết cô xét nghiệm dương tính với Covid-19, đang tự cách ly.", "content": "Người đẹp thông báo trên Instagram hôm 12/4: \"Tôi đang thực hiện các biện pháp chữa trị cần thiết để khỏe lên. Những ai từng tiếp xúc với tôi trong vài qua nên xét nghiệm ngay lập tức\".\nHoa hậu khuyến cáo mọi người đeo khẩu trang, tuân thủ các quy định của chính phủ. Nhiều bạn bè chúc người đẹp chóng bình phục, trong đó có Miss Brazil - Julia Gama. \"Nhớ chăm sóc bản thân nhé. Gửi tình yêu và nguồn năng lượng tích cực từ Brazil\". Cả hai người đẹp đều đại diện quốc gia tham gia Miss Universe 2020 diễn ra tại Mỹ vào tháng 5, sau nửa năm bị dời lịch vì Covid-19. Trước Adline Castelino, Hoa hậu Aishwarya Rai của nước này cũng từng mắc Covid-19.\nẤn Độ mới trải qua đợt bùng phát Covid-19 tồi tệ nhất, với trung bình hơn 130.000 ca nhiễm mới mỗi ngày trong bảy ngày qua. Theo dữ liệu Bộ Y tế Ấn Độ công bố hôm nay, nước này đã ghi nhận kỷ lục 168.912 ca nhiễm mới trong vòng 24 giờ, nâng tổng số ca nhiễm lên hơn 13,5 triệu, vượt qua Brazil, trở thành vùng dịch lớn thứ hai thế giới, trong đó 170.179 người đã thiệt mạng.\nAdline Castelino đăng quang Miss Diva 2020, giành suất đại diện Ấn Độ tranh tài tại Hoa hậu Hoàn vũ tổ chức cuối năm nay. Người đẹp sinh năm 1998 tại thành phố Kuwait, Ấn Độ. Năm 15 tuổi, cô chuyển tới Mumbai và bắt đầu hứng thú với nghề mẫu. Adline Castelino cao 1,69 m, có thân hình cân đối, nhan sắc nổi bật. Nhiều chuyên trang sắc đẹp kỳ vọng cô giúp Ấn Độ tìm lại phong độ tại Miss Universe. Quốc gia châu Á từng hai lần có người đẹp đăng quang năm 1994 và 2000.\nTrên mạng xã hội, người hâm mộ tại Việt Nam đánh giá Adline Castelino là đối thủ mạnh của Nguyễn Trần Khánh Vân - Hoa hậu Hoàn vũ Việt Nam - tại Miss Universe 2020. Năm ngoái, hai đại diện của Việt Nam và Ấn Độ đều dừng chân ở top 20 cuộc thi.\nHà Thu", "category": "Quốc tế", "pub_date": 1618246980.0, "keywords": ["Adline Castelino", "Miss Universe", "Cuộc sống sao", "Tin"], "tags": ["adline castelino", "miss universe"]}
{"link": "https://vnexpress.net/hoang-thuy-toi-khong-de-mat-tinh-yeu-vi-cong-viec-4259844.html", "title": "Hoàng Thùy: 'Tôi không để mất tình yêu vì công việc'", "description": "Á hậu Hoàng Thùy cho biết ở tuổi 29, cô hạnh phúc với mối quan hệ nghiêm túc, sau hai lần từ bỏ tình yêu vì sự nghiệp.", "content": "Hoàng Thùy sinh năm 1992 ở Thanh Hóa, là quán quân cuộc thi Vietnam’s Next Top Model 2011. Người đẹp cao 1,77 m, số đo ba vòng là 82-60-94 cm. Năm 2015, cô đầu quân cho công ty đào tạo người mẫu PRM tại Anh, trúng nhiều show diễn ở Tuần thời trang London. Năm 2017, cô về nước, trở thành huấn luyện viên cuộc thi The Face Vietnam. Cùng năm, Hoàng Thùy tham gia Hoa hậu Hoàn vũ Việt Nam và giành vị trí á hậu 1. Năm 2019, cô được đề cử đi thi Miss Universe và vào Top 20. Cô vào Top 100 mỹ nhân đẹp nhất thế giới do trang Starmometer của Philippines công bố, dựa trên cuộc bình chọn với 14 triệu lượt người tham gia năm 2020.\nThái Bảo - Vân An", "category": "Trong nước", "pub_date": 1618160400.0, "keywords": ["á hậu Hoàng Thùy", "người yêu Hoàng Thùy", "Cuộc sống sao", "Chân dung nhân vật", "Phỏng vấn", "Tin nóng"], "tags": ["á hậu hoàng thùy", "người yêu hoàng thùy"]}
{"link": "https://vnexpress.net/hoa-hau-an-do-dien-mot-nguc-tran-4261441.html", "title": "Hoa hậu Ấn Độ diện mốt ngực trần", "description": "Hoa hậu Ấn Độ Priyanka Chopra không mặc áo ngực, tạo dáng trên thảm đỏ lễ trao giải BAFTA 2021, tối 11/4.", "content": "Lễ trao giải điện ảnh Viện Hàn lâm Anh lần thứ 74 diễn ra trong hai đêm 10 và 11/4 tại Royal Albert Hall ở London, không có khán giả. Tới dự sự kiện, Priyanka Chopra diện bộ quần áo của Pertegaz, điểm nhấn là chiếc áo thêu tay xẻ một đường chính giữa giúp người đẹp khoe vòng một không nội y. Ảnh: Shuterstock.\nLễ trao giải điện ảnh Viện Hàn lâm Anh lần thứ 74 diễn ra trong hai đêm 10 và 11/4 tại Royal Albert Hall ở London, không có khán giả. Tới dự sự kiện, Priyanka Chopra diện bộ quần áo của Pertegaz, điểm nhấn là chiếc áo thêu tay xẻ một đường chính giữa giúp người đẹp khoe vòng một không nội y. Ảnh: Shuterstock.\n\n\n\nPriyanka Chopra chụp hình cùng chồng trước sự kiện. Video: Instagram Priyanka Chopra.\nPhoebe Dynevor diện đầm một tay áo dáng đuôi cá của Louis Vuitton. Ảnh: Shuterstock.\nPhoebe Dynevor diện đầm một tay áo dáng đuôi cá của Louis Vuitton. Ảnh: Shuterstock.\nGugu Mbatha-Raw diện đầm suông hai dây thêu chỉ ánh kim của Louis Vuitton. Ảnh: Shuterstock.\nGugu Mbatha-Raw diện đầm suông hai dây thêu chỉ ánh kim của Louis Vuitton. Ảnh: Shuterstock.\nCynthia Erivo diện váy ngắn của Louis Vuitton. Ảnh: Shuterstock.\nCynthia Erivo diện váy ngắn của Louis Vuitton. Ảnh: Shuterstock.\nBộ đầm cổ vuông với tay áo kết hợp găng tay hai trong một của Dilara Findikoglu giúp Celeste tạo ấn tượng. Ảnh: Shuterstock.\nBộ đầm cổ vuông với tay áo kết hợp găng tay hai trong một của Dilara Findikoglu giúp Celeste tạo ấn tượng. Ảnh: Shuterstock.\nRenée Zellweger được tôn dáng với đầm cúp ngực vải nhũ ánh xanh của Armani. Ảnh: Shuterstock.\nRenée Zellweger được tôn dáng với đầm cúp ngực vải nhũ ánh xanh của Armani. Ảnh: Shuterstock.\nAndra Day chọn đầm cổ yếm với đường viền được trang trí bằng chi tiết kim loại của Elie Saab. Ảnh: Shuterstock.\nAndra Day chọn đầm cổ yếm với đường viền được trang trí bằng chi tiết kim loại của Elie Saab. Ảnh: Shuterstock.\nAnna Kendrick khoe chân với đầm ánh kim của Zuhair Murad. Ảnh: Shuterstock.\nAnna Kendrick khoe chân với đầm ánh kim của Zuhair Murad. Ảnh: Shuterstock.\nRose Byrne chọn suit vải dạ, dáng cách tân của Miu Miu. Ảnh: Shuterstock.\nRose Byrne chọn suit vải dạ, dáng cách tân của Miu Miu. Ảnh: Shuterstock.\nMột số nghệ sĩ tham dự chương trình từ xa vì dịch, trong đó có Vanessa Kirby. Cô chọn đầm tối giản, cao cấp của Versace, chụp hình và gửi ảnh tới buổi lễ. Ảnh: Versace.\nMột số nghệ sĩ tham dự chương trình từ xa vì dịch, trong đó có Vanessa Kirby. Cô chọn đầm tối giản, cao cấp của Versace, chụp hình và gửi ảnh tới buổi lễ. Ảnh: Versace.\nMaria Bakalova khoe ngực với đầm cao cấp đính pha lê, kim sa họa tiết hoa nhí của Armani. Ảnh: Maria Bakalova.\nMaria Bakalova khoe ngực với đầm cao cấp đính pha lê, kim sa họa tiết hoa nhí của Armani. Ảnh: Maria Bakalova.\nKosar Ali diện cả bộ màu trắng của Alexander McQueen. Ảnh: Alexander McQueen.\nKosar Ali diện cả bộ màu trắng của Alexander McQueen. Ảnh: Alexander McQueen.", "category": "Sao đẹp - Sao xấu", "pub_date": 1618193337.0, "keywords": ["Hoa hậu Ấn Độ diện mốt ngực trần - VnExpress"], "tags": ["baftas 2021", "hoa hậu ấn độ", "priyanka chopra", "phoebe dynevor", "andra day", "vanessa kirby", "renée zellweger", "anna kendrick", "thời trang thảm đỏ"]}
{"link": "https://vnexpress.net/anh-khang-ra-mv-ve-tinh-nghia-vo-chong-4261531.html", "title": "Anh Khang ra MV về tình nghĩa vợ chồng", "description": "Anh Khang, em trai Ngọc Anh 3A, ra MV \"Trọn tình phu thê\" về cuộc hôn nhân của anh.", "content": "Ca khúc do anh tự viết lời và hòa âm phối khí. Anh nói về cảm hứng sáng tác: \"Vợ chồng nếu không có sự yêu thương, chia sẻ, cùng nhìn về mặt tích cực, khó có được hạnh phúc trọn vẹn\". Ca sĩ cho biết vợ rất thích ca khúc Trọn tình phu thê từ khi là bản demo. Bà xã anh sinh năm 1996, là người Hải Phòng, tính cách hiền lành, dễ chịu. Cả hai kết hôn vào năm ngoái\nMV được quay đơn giản chủ yếu tập vào giai điệu nhẹ nhàng, ca từ ngọt ngào Sang Mỹ định cư được tám năm, Anh Khang vẫn hoạt động âm nhạc. Bên cạnh đi hát, anh còn giữ vai trò nhà sản xuất cho các nghệ sĩ hải ngoại.\nAnh Khang sinh năm 1989. Năm 2013, anh theo chị gái - ca sĩ Ngọc Anh 3A - sang Mỹ định cư. Anh cũng như chị gái, trưởng thành trong môi trường nghệ thuật (bố là Nghệ sĩ Nhân dân Hoàng Khiềm, nguyên giám đốc Nhà hát tuồng Việt Nam). Được đào tạo chuyên ngành piano từ năm sau tuổi, Anh Khang có thể chơi piano, guitar, trống, sáo... Nhiều sáng tác của anh đã được trình làng trong album đầu tay, hay trong chương trình Bài hát Việt như Anh mơ, Ngày mai nắng lên anh sẽ về, Ngày xưa em đến, Bèo dạt mây trôi...\nTâm Giao", "category": "Làng nhạc", "pub_date": 1618237793.0, "keywords": ["Anh Khang", "MV Trọn tình phu thê", "Ngọc Anh 3A", "Sản phẩm", "Tin"], "tags": ["anh khang", "mv trọn tình phu thê", "ngọc anh 3a"]}
{"link": "https://vnexpress.net/hoa-hau-chau-a-1997-pha-san-4261594.html", "title": "Hoa hậu châu Á 1997 phá sản", "description": "Hàn Quân Đình - Hoa hậu châu Á 1997 - cho biết phá sản, không đủ khả năng trả nợ.", "content": "Trên Chinapress ngày 11/4, Quân Đình tiết lộ đệ đơn xin phá sản lên tòa án hồi tháng 1. Cô từng kinh doanh thẩm mỹ viện nhưng vì dịch, công ty không có thu nhập. Diễn viên còn phải trả khoản nợ 400.000 HKD (gần 1,2 tỷ đồng) vay bốn năm trước để trang trải phí chữa bệnh ung thư phổi cho mẹ. Mẹ cô qua đời năm 2018.\nHàn Quân Đình tiết lộ cô tiêu pha dè sẻn, mua một ly cà phê cũng phải đắn đo. Cô được một số bạn bè giúp đỡ tìm công việc ngắn hạn như làm MC, tham gia các chương trình phát Internet. Quân Đình nói khó có cơ hội trở lại đóng phim do mũi bị lệch sau lần ngã trong nhà tắm. \"Tôi còn từng bị trầm cảm, có lẽ không ai dám mời tôi đóng phim, sợ tôi mất kiểm soát\", diễn viên nói.\nDiễn viên cho biết dù khó khăn, cô tin \"ông trời không triệt đường sống\". Cô sẽ cố gắng tìm việc làm, trả nợ. Cô sinh năm 1975, thi Hoa hậu châu Á 1997 và đoạt giải á hậu. Sau đó, quán quân cuộc thi - Chu Yến Trân - bị tước vương miện do giấu chuyện kết hôn, vì thế Hàn Quân Đình được đôn lên làm hoa hậu. Cô từng đóng nhiều phim của các nhà đài Hong Kong TVB, ATV như Tây quan đại thiếu, Yểu điệu thục nữ, Bàn tay nhân ái 3, Ước hẹn mùa xuân 2...\nNhư Anh", "category": "Quốc tế", "pub_date": 1618202628.0, "keywords": ["Hàn Quân Đình", "Hoa hậu châu Á", "Sao phá sản", "Cuộc sống sao", "Tin"], "tags": ["hàn quân đình", "hoa hậu châu á", "sao phá sản"]}
{"link": "https://vnexpress.net/hugh-jackman-ky-niem-25-nam-cuoi-4261667.html", "title": "Hugh Jackman kỷ niệm 25 năm cưới", "description": "Tài tử Hugh Jackman đăng tải loạt ảnh cưới nhân kỷ niệm 25 năm kết hôn với vợ hơn 13 tuổi - Deborra-Lee Furness.", "content": "Nam diễn viên Wolverine viết trên Instagram hôm 11/4: \"Lần đầu gặp, tôi đã biết định mệnh của chúng tôi là ở bên nhau. 25 năm qua, tình cảm ngày càng đậm sâu... Tôi rất biết ơn được chia sẻ tình yêu, cuộc sống và gia đình với em. Tất cả chỉ là bắt đầu\".\nJackman lấy nữ diễn viên Furness, hơn anh 13 tuổi, năm 1996 tại quê nhà Australia của hai người. Cặp sao quen trên phim trường Correlli một năm trước đó. Hơn hai thập kỷ bên nhau, Jackman nổi tiếng với những hành động lãng mạn dành cho vợ. Năm 2019, anh rủ vợ đi nghe nhạc và bất ngờ lên sân khấu hát ca khúc All the Way của Frank Sinatra. Hai người chọn phát ca khúc trong lễ cưới và nhảy điệu valse đầu tiên với tư cách vợ chồng.\nTrên THR, Hugh Jackman nói vợ ảnh hưởng lớn nhất tới sự nghiệp của anh. Anh nói: \"Không có cô ấy, tôi sẽ không bằng được một phần tư bây giờ\". Anh phản bác về những dị nghị khoảng cách tuổi tác hai người: \"Tôi không quan tâm tới vẻ ngoài. Trong mắt tôi, cô ấy là người phụ nữ quyến rũ nhất trên đời\".\nHugh Jackman, sinh năm 1968 tại Australia, nổi tiếng với vai Người sói trong loạt phim X-Men cùng các tác phẩm The Prestige, The Fountain, Les Misérables. Anh cũng gặt hái thành công trên sân khấu kịch Broadway và sự nghiệp ca hát.\nPhương Mai", "category": "Quốc tế", "pub_date": 1618217674.0, "keywords": ["Hugh Jackman", "Deborra-Lee Furness", "Wolverine", "Thời sự giải trí", "Tin"], "tags": ["hugh jackman", "deborra-lee furness", "wolverine"]}
{"link": "https://vnexpress.net/nam-phu-ha-canh-noi-anh-lo-tin-nhan-voi-ban-gai-cu-4261645.html", "title": "Nam phụ 'Hạ cánh nơi anh' lộ tin nhắn với bạn gái cũ", "description": "Kim Jung Hyun, từng đóng \"Hạ cánh nơi anh\", lộ tin nhắn nội dung phục tùng các yêu cầu của bạn gái cũ - Seo Ye Ji.", "content": "Ngày 12/4, trang Dispatch đăng ảnh chụp các đoạn nói chuyện giữa Kim Jung Hyun và Seo Ye Ji, tiết lộ họ từng bí mật yêu nhau. Năm 2018, khi Jung Hyun đóng phim Time, Seo Ye Ji yêu cầu bạn trai không tiếp xúc da với cộng sự nữ, không chào hỏi, thân thiện với thành viên nữ của đoàn phim, không đóng cảnh lãng mạn...\nKim Jung Hyun chấp nhận mọi yêu cầu của Ye Ji, đề nghị đoàn phim xóa các cảnh thân mật đã quay với bạn diễn nữ. Theo nguồn tin, đây là lý do Kim Jung Hyun diễn đoạn cưới Seo Hyun trong Time nhưng mặt cau có, khó chịu.\nCảnh phim Time cùng các video Kim Jung Hyun và Seo Hyun khi quảng bá tác phẩm được nhiều khán giả chia sẻ lại. Bấy giờ, Jung Hyun luôn tìm cách xa lánh Seo Hyun, từ chối khoác tay cô ở họp báo. Một thành viên đoàn phim nói: \"Seo Hyun cố gắng nhập vai còn Kim Jung Hyun luôn phá kịch bản. Seo Hyun từng phát khóc khi hợp tác với cậu ấy\".\nKim Jung Hyun vấp phải chỉ trích thiếu chuyên nghiệp, để đời tư ảnh hưởng công việc, xúc phạm cộng sự, không tôn trọng khán giả. Công ty quản lý của anh - O&Entertainment - cho biết công ty và nam diễn viên đang tranh chấp hợp đồng vì thế không phản hồi về sự việc. Jung Hyun muốn chấm dứt hợp đồng vào tháng 5 trong khi O&Entertainment cho rằng thời hạn quản lý tài tử kéo dài tới năm 2022. Theo Sports Chosunn, Jung Hyun muốn về công ty quản lý với Seo Ji Hye - bạn gái tin đồn của anh. Jung Hyun 31 tuổi, đóng phim từ 2014, từng tham gia Học đường 2017, Hạ cánh nơi anh, Bữa tối định mệnh...\nPhía Seo Ye Ji cũng chưa phản hồi về ồn ào ép bạn trai cũ xa lánh cộng sự nữ. Cô có kế hoạch dự sự kiện cùng đoàn phim Recalled ngày 13/4. Ye Ji 31 tuổi, được nhiều khán giả chú ý sau phim Điên thì có sao (2020), hợp tác Kim Soo Hyun.\nNhư Anh", "category": "Quốc tế", "pub_date": 1618211368.0, "keywords": ["Kim Jung Hyun", "Seo Ye Ji", "Seo Hyun", "Hạ cánh nơi anh  Stay With Me", "Cuộc sống sao", "Tin"], "tags": ["kim jung hyun", "seo ye ji", "seo hyun", "hạ cánh nơi anh  stay with me"]}
{"link": "https://vnexpress.net/samsung-engineering-muon-dau-tu-nha-may-xu-ly-nuoc-o-binh-dinh-4261176.html", "title": "Samsung Engineering muốn đầu tư nhà máy xử lý nước ở Bình Định", "description": "Doanh nghiệp Hàn Quốc đã đề xuất với Bình Định xây dựng nhà máy xử lý và cung cấp nước sạch cho thị xã An Nhơn.", "content": "Nhà máy được dự kiến xây dựng tại hồ Núi Một, thị xã An Nhơn, do liên danh Samsung Engineering Việt Nam và Công ty cổ phần Công nghệ môi trường và Xây dựng Sài Gòn (SENCO) thực hiện.\nTheo Sở Xây dựng tỉnh, An Nhơn đang có 1 hệ thống cung cấp nước sạch vùng trung tâm còn các vùng phụ cận chưa được đầu tư. Trong các công trình, dự án hạ tầng kỹ thuật ưu tiên đầu tư 5 năm tới, dự án nhà máy cấp nước hồ Núi Một, công suất 20.000 m3 một ngày đêm đến năm 2025 và tăng gấp đôi đến năm 2035 để phục vụ khu công nghiệp phía Nam Quốc lộ 19 và khu đô thị An Nhơn đang được thu hút đầu tư mạnh.\nSở đang tham vấn với thị xã An Nhơn để có cơ sở tham mưu cho lãnh đạo tỉnh Bình Định quyết định đầu tư dự án. Tuy nhiên, khảo sát sơ bộ, Sở cũng nhận thấy các khu dân cư có nhu cầu sử dụng nước vẫn còn rải rác nên đây sẽ là vấn đề cần chú ý.\nÔng Nguyễn Tuấn Thanh, Phó chủ tịch UBND tỉnh đề nghị Samsung Engineering Việt Nam tập trung nghiên cứu dự án và sớm trình Bình Định đề xuất dự án đầu tư theo hình thức đầu tư trực tiếp và nguồn vốn ODA.\nTrong các năm 2018, 2019 và tháng 3/2021, Bình Định đã tổ chức Hội thảo xúc tiến đầu tư với Hàn Quốc. Với tập đoàn đa ngành như Samsung, Bình Định mong muốn tập đoàn tìm hiểu, khảo sát kỹ lưỡng để đầu tư vào các lĩnh vực mà tỉnh đang mời gọi như công nghiệp chế biến, chế tạo, điện tử, ô tô...\nKỳ Duyên ", "category": "Doanh nghiệp", "pub_date": 1618109182.0, "keywords": ["Samsung Engineering", "bình định", "đầu tư", "Tin nóng", "Sức khỏe doanh nghiệp", "Tin"], "tags": ["samsung engineering", "bình định", "đầu tư"]}
{"link": "https://vnexpress.net/uber-trung-quoc-bi-mat-nop-don-ipo-tai-my-4261189.html", "title": "'Uber Trung Quốc' bí mật nộp đơn IPO tại Mỹ", "description": "Bloomberg trích nguồn tin thân cận cho biết hãng gọi xe Trung Quốc Didi Chuxing đã bí mật nộp đơn IPO lên Ủy ban Chứng khoán Mỹ (SEC).", "content": "Nguồn tin của Bloomberg cho biết Didi Chuxing có thể được định giá 70 – 100 tỷ USD. Dù vậy, quy mô và thời gian niêm yết có thể còn thay đổi. Hãng này cũng đang nghiên cứu việc niêm yết thêm trên sàn Hong Kong sau này.\nCông ty này đã chọn hai ngân hàng Goldman Sachs Group và Morgan Stanley làm bảo lãnh phát hành. Mục tiêu của họ là huy động vài tỷ USD trong IPO.\nDidi đã tăng tốc kế hoạch IPO khi việc kinh doanh hồi phục sau đại dịch. Hôm 9/4, hãng này đã huy động 1,5 tỷ USD từ vay nợ để củng cố nguồn vốn trước IPO.\nViệc Didi nộp đơn IPO diễn ra khi Grab Holdings nhận được sự ủng hộ của T. Rowe Price Group và Temasek Holdings cho kế hoạch IPO thông qua sáp nhập với một SPAC (công ty mua lại có mục đích đặc biệt). Nguồn tin của Bloomberg cho biết Grab có thể thông báo kế hoạch này ngay trong tuần sau.\nThương vụ sẽ định giá Grab khoảng 34 tỷ USD. Đây có thể là vụ sáp nhập với SPAC lớn nhất đến nay và Grab cũng là công ty kỳ lân đầu tiên của Đông Nam Á IPO theo cách này.\nDidi được coi là phiên bản Trung Quốc của hãng gọi xe Mỹ Uber Technologies. Hãng này đã mua lại mảng kinh doanh của Uber tại Trung Quốc năm 2016. SoftBank là một trong những nhà đầu tư mạnh tay nhất vào công ty này.\nHà Thu (theo Bloomberg)", "category": "Quốc tế", "pub_date": 1618113009.0, "keywords": ["Uber Trung Quốc", "Didi Chuxing", "đi chung xe", "gọi xe", "IPO", "Sức khỏe doanh nghiệp", "Tin"], "tags": ["uber trung quốc", "didi chuxing", "đi chung xe", "gọi xe", "ipo"]}
{"link": "https://vnexpress.net/bat-dong-san-keo-vo-no-trai-phieu-trung-quoc-len-ky-luc-4261197.html", "title": "Bất động sản kéo vỡ nợ trái phiếu Trung Quốc lên kỷ lục", "description": "Các công ty bất động sản chiếm 27% trong 15,1 tỷ USD vỡ nợ trái phiếu doanh nghiệp Trung Quốc trong quý I.", "content": "Dữ liệu của Bloomberg cho biết, trong 3 tháng đầu năm, các doanh nghiệp Trung Quốc đã vỡ nợ 11,4 tỷ USD trái phiếu phát hành trong nước, cao hơn gấp đôi kỷ lục cũ thiết lập năm ngoái. Còn vỡ nợ trái phiếu phát hành ở nước ngoài tăng gần gấp 3, lên 3,7 tỷ USD. Lĩnh vực bất động sản chiếm 27% tổng giá trị các vụ vỡ nợ.\nChính phủ Trung Quốc đang áp dụng biện pháp hạn chế tình trạng nợ gia tăng trong bất động sản, tái tập trung vào các rủi ro tài chính sau một thời gian ngừng lại vì Covid-19. Tháng trước, giới chức ngân hàng Trung Quốc đã bày tỏ lo ngại về bong bóng bất động sản.\nCác diễn biến trên thị trường gần đây cũng cho thấy rủi ro ngày càng tăng đối với các nhà đầu tư. Các công ty bất động sản nhằm trong nhóm doanh nghiệp bị ảnh hưởng nhiều nhất từ nỗ lực giảm nợ của Bắc Kinh.\nNhà phân tích Huang Weiping tại Công ty chứng khoán Industrial đánh giá các nhà hoạch định chính sách Trung Quốc sẽ để nhiều công ty vỡ nợ hơn trong năm nay, đặc biệt là các doanh nghiệp nhà nước trong lĩnh vực năng lượng và công ty bất động sản vay nhiều, nợ chồng chất.\nTỷ lệ vỡ nợ trái phiếu doanh nghiệp bất động sản trung Quốc đã tăng nhanh trong vài năm qua. Trong quý I/2021, theo dữ liệu của Bloomberg, China Fortune Land Development và Tianjin Real Estate Group đã mất khả năng thanh toán 10 tỷ nhân dân tệ trái phiếu. Công ty máy tính Tsinghua Unigroup và Hainan Airlines Holding cũng chạm mức tương đương trong thời gian này.\nNếu chia theo địa phương, Hải Nam có tỷ lệ vỡ nợ trái phiếu cao nhất trong quý I với 23 tỷ NDT. Bắc Kinh và Thiên Tân lần lượt ở các vị trí thứ hai và ba.\nĐức Minh (Theo Bloomberg)", "category": "Bất động sản", "pub_date": 1618111389.0, "keywords": ["bất động sản trung quốc", "bong bóng bất động sản", "vỡ nợ", "Tin nóng", "Sức khỏe doanh nghiệp", "Tin"], "tags": ["bất động sản trung quốc", "bong bóng bất động sản", "vỡ nợ"]}
