{"link": "https://vnexpress.net/10-ty-phu-tre-nhat-the-gioi-4259071.html", "title": "10 tỷ phú trẻ nhất thế giới", "description": "Có 4 trên 10 tỷ phú trẻ nhất thế giới năm 2021 là tỷ phú tự thân và tất cả đều đến từ Mỹ.", "content": "1. Kevin David LehmannTuổi: 18\nTài sản: 3,3 tỷ USD\nNguồn tài sản: Kinh doanh dược phẩmQuốc tịch: Đức\nTỷ phú trẻ nhất hành tinh năm nay thừa kế 50% cổ phần của người cha là ông Guenther Lehmann trong chuỗi cửa hàng thuốc drogerie markt của Đức. Thực tế, ông Guenther đã chuyển nhượng cổ phần cho con trai khi anh 14 tuổi, nhưng dưới dạng ủy thác. Vào tháng 9/2020, khi tròn 18 tuổi, Kevin chính thức nắm quyền sở hữu số cổ phần này, giúp anh bước vào danh sách tỷ phú thế giới.\n2. Wang ZelongTuổi: 24\nTài sản: 1,5 tỷ USD\nNguồn tài sản: Sản xuất hóa chất\nQuốc tịch: Trung Quốc\nWang được thừa kế số cổ phần trị giá hơn 1,3 tỷ USD trong CNNC Hua Yuan Titanium Dioxide, công ty niêm yết trên sàn chứng khoán Thâm Quyến. Công ty này sản xuất titanium dioxide, một chất màu trắng được sử dụng trong lớp phủ, chất dẻo, mực in và các vật liệu khác.\n3. Alexandra Andresen\nTuổi: 24\nTài sản: 1,4 tỷ USD\nNguồn tài sản: Công ty đầu tư\nQuốc tịch: Na Uy\n4. Katharina AndresenTuổi: 25\nTài sản: 1,4\nNguồn tài sản: Công ty đầu tư\nQuốc tịch: Na Uy\nHai chị em nhà Andresen mỗi người được thừa kế 42% cổ phần của Ferd, một công ty đầu tư có trụ sở tại Bærum (Na Uy), với doanh thu hàng năm khoảng 2 tỷ USD. Cả hai bước vào danh sách tỷ phú vào năm 2016. Cha của họ, ông Johan Andersen, vẫn điều hành công việc kinh doanh Ferd và kiểm soát 70% quyền biểu quyết trong công ty. Ferd điều hành các quỹ đầu cơ, là một nhà đầu tư tích cực trên thị trường chứng khoán Bắc Âu và có các khoản đầu tư cổ phần tư nhân.\n5. Austin Russell\nTuổi: 25\nTài sản: 2,4 tỷ USD\nNguồn tài sản: Công nghệ ôtô\nQuốc tịch: Mỹ\nAustin Russell là tỷ phú tự thân. Anh được mệnh danh là thần đồng quang học và đã dành tuổi thiếu niên để nghiên cứu tại Đại học California tại Viện Laser Beckman (Irvine). Năm 2021, anh bỏ học Stanford khi được trao học bổng trị giá 100.000 USD từ tỷ phú công nghệ Peter Thiel, để sáng lập Luminar Technologies, chuyên sản xuất các cảm biến dùng trong ôtô tự lái.\nCác cảm biến của công ty anh giúp cho ôtô phát hiện các vật thể xung quanh nhằm hỗ trợ cho quá trình tự vận hành và đã cung cấp cho Volvo, Toyota và Mobileye của Intel. Tháng 12/2020, Luminar Technologies được niêm yết lên sàn thông qua sáp nhập với SPAC, giúp anh trở thành tỷ phú sau một đêm. Russell hiện sở hữu khoảng một phần ba công ty.\n6. Gustav Magnar Witzoe\nTuổi: 27\nTài sản: 4,4 tỷ USD\nNguồn tài sản: Thủy sản\nQuốc tịch: Na Uy\nWitzoe sở hữu gần một nửa SalMar ASA, nhà sản xuất cá hồi Na Uy mà cha của anh sáng lập năm 1991. Tài sản của Witzoe tăng gần gấp đôi trong năm qua nhờ kết quả kinh doanh tích cực của SalMar. Cổ phần của Witzoe trong công ty là do cha anh tặng năm 2013.\n7. Andy Fang\nTuổi: 28\nTài sản: 2 tỷ USD\nNguồn tài sản: Dịch vụ giao thức ăn\nQuốc tịch: Mỹ\n8. Stanley TangTuổi: 28\nTài sản: 2 tỷ USD\nNguồn tài sản: Dịch vụ giao thức ăn\nQuốc tịch: Mỹ\nDoorDash, ứng dụng giao đồ ăn mà Fang và Tang đồng sáng lập vào năm 2013, trở nên thịnh hành hơn bao giờ hết trong thời kỳ đại dịch, khi các nhà hàng và khách hàng đều chuyển sang giao hàng. Công ty đã được niêm yết trên sàn giao dịch chứng khoán New York tháng 12/2020. Fang trước đây là giám đốc công nghệ của công ty, trong khi Tang là giám đốc sản phẩm.\n9. Sam Bankman-Fried\nTuổi: 29\nTài sản: 8,7 tỷ USD\nNguồn tài sản: Giao dịch tiền mã hóa\nQuốc tịch: Mỹ\nBankman-Fried đã xây dựng khối tài sản khổng lồ với tốc độ đáng kinh ngạc, khi lập 2 công ty giao dịch liên quan đến tiền mã hóa là: Alameda Research - quản lý tài sản 2,5 tỷ USD và nền tảng giao dịch phái sinh tiền mã hóa FTX.\nBankman-Fried là người sống theo \"Chủ nghĩa vị tha hiệu quả\" (Effective Altruism). Mục tiêu của anh là kiếm nhiều tiền nhất có thể để anh có thể cho đi nhiều nhất có thể. Năm 2020, anh đã quyên góp 5 triệu USD cho chiến dịch tranh cử của Biden, đưa anh thành một trong những nhà tài trợ lớn nhất của tổng thống.\n10. Jonathan Kwok\nTuổi: 29\nTài sản: 2,4 tỷ USD\nNguồn tài sản: Bất động sản\nQuốc tịch: Hong Kong (Trung Quốc)\nJonathan và anh trai của mình, Geoffrey, 35 tuổi, mỗi người được thừa kế từ người cha quá cố Walter Kwok (mất năm 2018) một phần cổ phần trong nhà phát triển bất động sản Hong Kong Sun Hung Kai Properties.\nÔng Walter bị lật đổ khỏi vị trí Chủ tịch Sun Hung Kai năm 2008 do hiềm khích với hai anh em Thomas và Raymond Kwok. Sau đó, ông thành lập công ty phát triển bất động sản Empire Group Holdings, công ty mà Jonathan và Geoffrey đang điều hành.\nPhiên An (theo Forbes)", "category": "Doanh nhân", "pub_date": 1617742800.0, "keywords": ["tỷ phú năm 2021", "10 tỷ phú trẻ nhất", "tỷ phú trẻ nhất thế giới", "Giao dịch mua bán", "sáp nhập", "đầu tư", "Tin nóng", "Nhân sự thương trường", "Tin"], "tags": ["tỷ phú năm 2021", "10 tỷ phú trẻ nhất", "tỷ phú trẻ nhất thế giới", "giao dịch mua bán", "sáp nhập", "đầu tư"]}
{"link": "https://vnexpress.net/5-bi-quyet-so-huu-lan-da-rang-ngoi-don-tet-4228326.html", "title": "5 bí quyết sở hữu làn da rạng ngời đón Tết", "description": "Tẩy trang, tẩy tế bào chết, đắp mặt nạ... hay sử dụng các sản phẩm chăm sóc da là những bước giúp làn da luôn căng bóng, mịn màng.", "content": "Bên cạnh đó, để có làn da tươi sáng, chị em cũng đừng quên uống đủ nước, bổ sung thêm các loại vitamin từ thực phẩm, rau củ quả và đi ngủ sớm, đủ giấc để làn da được chăm sóc và đẹp từ trong ra ngoài.\n(Nguồn và ảnh: Klair)", "category": "Làm đẹp", "pub_date": 1611979200.0, "keywords": ["Klair", "chăm sóc da", "dưỡng trắng", "Chân dung nhân vật", "Tin"], "tags": ["klair", "chăm sóc da", "dưỡng trắng"]}
{"link": "https://vnexpress.net/kylie-jenner-trang-diem-cho-cha-4233242.html", "title": "Kylie Jenner trang điểm cho cha", "description": "Kylie Jenner lần đầu trang điểm cho Caitlyn Jenner - người cha chuyển giới của cô.", "content": "Hôm 7/2, Caitlyn chia sẻ đoạn video được con gái trang điểm tông nude chủ đạo, phấn má hồng tự nhiên, phấn mắt nâu và son kem màu hồng đất. Khi bên nhau, hai cha con cùng nói về nhiều chủ đề. Kylie Jenner khen cha có nhiều kinh nghiệm kẻ viền môi và uốn mi hơn cô, còn Caitlyn tiết lộ từng lén trang điểm rất nhiều từ lúc con gái chưa ra đời.\nHọ cũng nói về việc Caitlyn Jenner công khai là người chuyển giới. Kylie hỏi cha: \"Đôi khi mọi người thực sự bối rối khi chị Kendall và con vẫn gọi bố là 'bố'. Vài năm trước, khi chúng ta nói chuyện với nhau, bố vẫn ổn khi chúng con gọi như thế. Còn bây giờ thì sao ạ?\". Caitlyn trả lời: \"Thật khó để thay đổi cách xưng hô. Nhưng đó là một trong những quyết định tốt nhất, đúng nhất mà bố đã chọn, dù mọi người sẽ khó xử. Con có biết biết điều gì là tốt không? Là sau những gì bố đã trải qua, mặc những gì người ta nói ngoài kia, bố có thể thức dậy vào buổi sáng và được là chính mình cả một ngày\".\nCaitlyn Jenner, tên thật William Bruce Jenner, sinh năm 1949, là cha ruột của Kylie Jenner và Kendall Jenner. Vợ thứ ba của Caitlyn - Kris Jenner - là mẹ của Kim Kardashian. Khi còn là đàn ông, Caitlyn có sự nghiệp thể thao thành công, từng đoạt huy chương vàng Olympic ở bộ môn điền kinh 10 môn phối hợp. Caitlyn công khai là người chuyển giới từ giữa năm 2015, khi đang ở tuổi 65. Bà cho biết quãng đời trước đó là cuộc chiến với bệnh rối loạn định dạng giới (gender dysphoria). Là người nổi tiếng, việc Caitlyn công khai giới tính nhận nhiều chú ý từ truyền thông. Mỗi hành động của bà đều được ghi lại, khiến cuộc sống từng rất căng thẳng.\nHọa Mi (theo Elle)", "category": "Làm đẹp", "pub_date": 1612774800.0, "keywords": ["Kylie Jenner", "Caitlyn Jenner", "Cuộc sống sao", "Thời sự giải trí", "Tin"], "tags": ["kylie jenner", "caitlyn jenner"]}
{"link": "https://vnexpress.net/irina-shayk-dap-vang-len-moi-4234910.html", "title": "Irina Shayk đắp vàng lên môi", "description": "Siêu mẫu Irina Shayk đắp mặt nạ môi bằng vàng 24 carat trong quảng cáo mới.", "content": "Irina Shayk vừa hợp tác chuyên gia thẩm mỹ nổi tiếng Mimi Luzon tạo ra bộ sản phẩm chăm sóc môi làm từ vàng 24 carat, sáp ong và bơ hạt mỡ. Trong đó, mặt nạ môi vàng được rao bán với giá 129 USD.\nTheo Vogue, siêu mẫu cho biết cô thích dưỡng ẩm môi bằng vàng - bí quyết làm đẹp nổi tiếng của nữ hoàng Cleopatra. Phương pháp này giúp kích thích tái tạo tế bào, giảm khô và nếp nhăn, đồng thời mang lại làn da tươi trẻ.\nMimi Luzon là chuyên gia làm đẹp nổi tiếng với cách chăm sóc da mặt bằng vàng được nhiều ngôi sao yêu thích như Naomi Campbell, Gigi và Bella Hadid. Dòng sản phẩm 24K Pure Gold của cô gồm sản phẩm trị liệu da mặt 436 USD, điều trị mắt 249 USD và huyết thanh hyaluronic 299 USD, bột vàng 99 USD có thể được trộn vào bất kỳ loại kem dưỡng ẩm nào.\nIrina Shayk, 35 tuổi, là siêu mẫu người Nga từng được trang Models trao danh hiệu \"Biểu tượng của làng mẫu\". Cô từng làm việc cho nhiều hãng thời trang hàng đầu như Victoria's Secret, Armani, Versace... Irina cũng nổi tiếng vì từng hẹn hò nhiều sao như cầu thủ bóng đá Cristiano Ronaldo, nhạc công Rob Bourdon... Năm 2017, cô có con gái với bạn trai - tài tử Bradley Cooper. Hai người chia tay tháng 6/2019 vì Bradley quá tập trung làm phim A Star Is Born, bỏ bê gia đình. Cả hai hiện giữ quan hệ bạn bè, tập trung chăm sóc con.\nHọa Mi (theo Vogue)", "category": "Làm đẹp", "pub_date": 1613122200.0, "keywords": ["Irina Shayk", "Mimi Luzon", "mặt nạ môi bằng vàng", "Sản phẩm", "Tin"], "tags": ["irina shayk", "mimi luzon", "mặt nạ môi bằng vàng"]}
{"link": "https://vnexpress.net/hailey-bieber-thanh-lap-dong-my-pham-4232054.html", "title": "Hailey Bieber thành lập dòng mỹ phẩm", "description": "Người mẫu Hailey Bieber thành lập dòng mỹ phẩm riêng mang tên Rhode.", "content": "Theo Harper's Bazaar, Hailey Bieber vừa đăng ký tên nhãn hiệu mỹ phẩm cho các sản phẩm chăm sóc sức khỏe và sắc đẹp như: kem dưỡng ẩm, sữa tắm, sữa rửa mặt, tẩy da chết, chất khử mùi, nước hoa, chăm sóc tóc, trang điểm, kem chống nắng...\nBan đầu, Hailey nộp đơn đăng ký tên Bieber Beauty cho Văn phòng Nhãn hiệu & Bằng sáng chế Mỹ nhưng bị từ chối do trùng tên nhãn hiệu chồng cô đã đăng ký năm 2010. Sau đó, người đẹp đổi sang Dewy Beauty và cũng không được chấp nhận bởi nó gần giống thương hiệu Drew House của Justin Bieber. Cuối cùng cô chọn Rhode - tên đệm của cô.\nNăm qua, Hailey thường xuyên đăng các bài viết về chăm sóc da trên trang cá nhân. Cô tham gia lớp học về da liễu và thực hành với chồng - ca sĩ Justin Bieber - bằng cách điều trị mụn trứng cá cho anh.\nTrước Hailey, năm 2016, người mẫu Blac Chyna cũng từng gặp rắc rối khi đăng ký tên thương hiệu Angela Renee Kardashian. Cô bị ba chị em Kim, Khloé và Kourtney Kardashian phản đối vì cho rằng lợi dụng tên tuổi nhà họ để làm ăn sau khi đính hôn với Rob Kardashian.\nHọa Mi (theo Harper's Bazaar)", "category": "Làm đẹp", "pub_date": 1612508483.0, "keywords": ["Hailey Bieber", "Hailey Baldwin", "Rhode", "Thời sự giải trí", "Tin"], "tags": ["hailey bieber", "hailey baldwin", "rhode"]}
{"link": "https://vnexpress.net/toshiba-can-nhac-loi-chao-mua-tri-gia-hon-20-ty-usd-4259466.html", "title": "Toshiba cân nhắc lời chào mua trị giá hơn 20 tỷ USD", "description": "Cổ phiếu Toshiba hôm nay tăng kịch biên độ 18% trên sàn Tokyo sau khi khẳng định nhận được lời chào mua từ CVC Capital Partners.", "content": "Tập đoàn Nhật Bản cho biết đang tìm hiểu thêm thông tin và cân nhắc đề nghị này. Hội đồng quản trị Toshiba dự kiến họp hôm nay để thảo luận, Bloomberg trích nguồn tin thân cận cho biết.\nNikkei trước đó đưa tin CVC muốn đưa ra đề nghị mua lại và rút niêm yết Toshiba. Họ sẽ trả cao hơn 30% so với giá đóng cửa của cổ phiếu Toshiba hôm 6/4, qua đó định giá thương vụ tại 2.300 tỷ yen (21 tỷ USD). Đây sẽ là thương vụ thâu tóm lớn nhất của một công ty cổ phần tư nhân kể từ năm 2013 và cũng là lớn nhất đến nay của CVC.\nLời chào mua được đưa ra đúng thời điểm Toshiba đối mặt với sự dò xét từ các nhà hoạt động sau chuỗi scandal vài năm gần đây, từ khoản phạt kỷ lục vì gian lận kế toán, ghi nhận giảm giá tài sản tới hàng tỷ USD đến sự thất bại khi tham gia lĩnh vực năng lượng hạt nhân tại Mỹ.\nCEO Nobuaki Kurumatani đã được bổ nhiệm để khôi phục niềm tin nhà đầu tư. Hiện tại, Toshiba vẫn là người chơi lớn trong mảng quốc phòng và năng lượng tại quê nhà. Họ cũng sở hữu cổ phần lớn trong hãng chip Kioxia Holdings. Hãng này tách ra từ Toshiba và đổi tên năm 2019. Kioxixa được cho là sẽ IPO hè này.\n\"Các cổ đông có thể cảm thấy hấp dẫn vì CVC chào mua giá cao hơn\", Naoki Fujiwara - giám đốc quỹ tại Shinkin Asset Management cho biết. Tuy nhiên, \"việc này cần sự cho phép của chính phủ Nhật Bản, do Toshiba tham gia vào quốc phòng. Có rất nhiều câu hỏi xung quanh tính khả thi của thương vụ này\".\nToshiba tham gia vào nhiều ngành công nghiệp nhạy cảm, khiến chính phủ lưỡng lự trong việc chấp thuận bán công ty này cho một thực thể nước ngoài. Bên cạnh đó, bỏ qua vấn đề pháp lý, CEO Kurumatani cũng phải đối mặt với các cổ đông đang bất mãn với công ty. Tháng trước, nhà đầu tư đã thông qua đề xuất của Effissimo Capital Management - cổ đông lớn nhất của Toshiba - để điều tra tính công bằng về biểu quyết trong đại hội cổ đông năm ngoái.\nHà Thu (theo Bloomberg)", "category": "Quốc tế", "pub_date": 1617784011.0, "keywords": ["Toshiba", "M&amp;amp", "A", "mua lại", "CVC Capital Partners", "Sức khỏe doanh nghiệp", "Tin"], "tags": ["toshiba", "m&amp", "a", "mua lại", "cvc capital partners"]}
{"link": "https://vnexpress.net/tiki-mien-phi-giao-lap-giam-gia-sau-hang-dien-tu-dien-lanh-4258663.html", "title": "Tiki miễn phí giao lắp, giảm giá sâu hàng điện tử điện lạnh", "description": "Không chỉ giảm giá nhiều sản phẩm tới 50%, Tiki còn áp dụng chương trình miễn phí giao hàng và lắp ráp theo lịch hẹn TikiPRO với các sản phẩm điện tử điện lạnh.", "content": "Ngoài ra, sàn thương mại điện tử này còn tặng kèm mã coupon, giảm thêm đến 2 triệu đồng cho các đơn hàng điện tử điện lạnh sử dụng dịch vụ TikiPRO hẹn giờ giao hàng và lắp đặt. Tất cả các chương trình ưu đãi được áp dụng tại Tiki duy nhất hôm nay (7/4)\nHiện Tiki áp dụng nhiều chương trình khuyến mãi dành cho nhóm hàng điện tử - điện lạnh với hàng loạt deal giảm mạnh đến 50%, coupon giảm thêm đến 2 triệu đồng khi sử dụng dịch vụ TikiPRO hẹn giờ giao hàng và lắp đặt tức thì, tạo điều kiện thuận lợi nhất cho khách hàng mua sắm các sản phẩm cồng kềnh và cần dịch vụ lắp đặt. Thông tin chi tiết tham khảo tại đây.\nDiệp Chi", "category": "Doanh nghiệp", "pub_date": 1617766200.0, "keywords": ["Tiki", "TikiPro", "miễn phí giao lắp", "điện tử điện lạnh", "Giá cả thị trường hàng hoá - tài sản", "Tin"], "tags": ["tiki", "tikipro", "miễn phí giao lắp", "điện tử điện lạnh"]}
{"link": "https://vnexpress.net/co-phieu-tpbank-vao-ro-vn30-4223278.html", "title": "Cổ phiếu TPBank vào rổ VN30", "description": "Kết quả kinh doanh tăng trưởng, mã TPB của TPBank được xếp chung rổ VN30, nhóm những cổ phiếu vốn hoá và thanh khoản lớn nhất sàn HoSE.", "content": "Vốn hóa gần đạt 1,2 tỷ USD sau thời gian liên tục lập các đỉnh mới, thanh khoản và khối lượng cổ phiếu tự do lưu hành trên thị trường cao, cổ phiếu TPB của TPBank chính thức được chọn vào trong danh mục VN30, những cổ phiếu được cho là tốt nhất trên thị trường chứng khoán.\nTheo công bố của Sở Giao dịch Chứng khoán TP HCM (HoSE), ba mã gồm: TPB, BVH, PDR đã vượt qua kỳ đánh giá đầu năm 2021 để được chọn vào rổ VN30.\nVN30 tập hợp những cổ phiếu có tính thanh khoản cao nhất nên giá của các cổ phiếu trong danh mục này phản ánh tốt nhất mối quan hệ cung cầu, từ đó hạn chế tình trạng làm giá như thường xảy ra với những cổ phiếu thanh khoản kém. Để vào được VN30, các mã cổ phiếu trải qua 3 bước sàng lọc về giá trị vốn hóa, khối lượng cổ phiếu tự do lưu hành trên thị trường (free-float) và thanh khoản.\nCác cổ phiếu trong danh mục VN30 không lựa chọn theo tiêu chuẩn chất lượng kết quả kinh doanh, song biểu đồ giá cổ phiếu liên tục tạo lập những đỉnh mới trong một thời gian dài, với khối lượng giao dịch lớn, đặc biệt là lượng mua lớn đến từ khối ngoại. Theo đánh giá, đây được xem là hàn thử biểu phản ánh chất lượng hoạt động kinh doanh của doanh nghiệp và niềm tin của các nhà đầu tư vào một viễn cảnh tươi sáng trong năm 2021.\nTừ cuối tháng 10/2020 đến nay, giá cổ phiếu TPBank đã liên tục lập đỉnh mới, tăng từ mức 18.660 đồng lên 28.800 đồng (chốt phiên giao dịch ngày 18/1), tương đương mức tăng gần 54%. Đáng chú ý mức tăng này ghi nhận sau khi các cổ đông đã được chia cổ phiếu thưởng 22,18% gần đây và ngân hàng đã phát hành cổ phiếu ưu đãi cho người lao động. Đây cũng là mức cao nhất của cổ phiếu TPB từ khi niêm yết trên sàn chứng khoán đến nay. Với mức giá trên, giá trị vốn hóa của ngân hàng TPBank đạt hơn 29.700 tỷ đồng, tương đương gần 1,2 tỷ USD.\nKết thúc năm 2020, tổng tài sản của ngân hàng đạt 206.316 tỷ đồng, tăng 24,47% so với năm 2019 và vượt hơn 14% kế hoạch năm. Tổng huy động 184.953 tỷ đồng, tăng 25,15% so với năm trước, trong khi dư nợ cũng có mức tăng trưởng tốt, khá cao so với toàn ngành. Tổng thu nhập hoạt động của TPBank trong năm 2020 ghi nhận ở mức 10.368 tỷ đồng, tăng 22,4% so với năm 2019.\nMặc dù biên lợi nhuận từ hoạt dộng tín dụng giảm đáng kể do ngân hàng chủ động giảm lãi vay cho khách hàng hiện hữu và hạ lãi suất cho vay mới, song nhờ dư nợ tín dụng vẫn tăng trưởng tích cực và thu nhập ngoài lãi, đặc biệt là thu từ dịch vụ và bảo hiểm tăng cao, giúp tổng doanh thu vẫn tăng trưởng.\nMặt khác, nhờ sở hữu một nền tảng ngân hàng số hiện đại và tích cực chuyển đổi số, TPBank tiết kiệm nhân lực và tối ưu hóa chi phí hoạt động, nên lợi nhuận trước thuế trong năm 2020 của TPBank vẫn tăng 11% so với năm trước và vượt gần 8% so với kế hoạch Đại hội đồng cổ đông đề ra. Chỉ số ROA và ROE tương ứng là 1,89% và 29,5%. Chỉ số chi phí trên thu nhập hoạt động thuần (CIR) cũng giảm đáng kể, xuống mức 39,69%, dù trong vài năm qua nhà băng này đầu tư lớn cho ngân hàng số và công nghệ mới.\nGiữa tháng 11/2020, TPBank được Ngân hàng Nhà nước chấp thuận tăng vốn điều lệ từ 8.565 tỷ đồng lên 10.716 tỷ đồng theo phương án phát hành cổ phiếu. Điều này sẽ giúp ngân hàng gia tăng được nguồn vốn trung dài hạn, đầu tư cơ sở vật chất, mở rộng mạng lưới hoạt động và đáp ứng nhu cầu tăng trưởng tín dụng ở những năm tiếp theo.\nVăn Nam", "category": "Ebank", "pub_date": 1611039000.0, "keywords": ["Chứng khoán Việt Nam", "cổ phiếu ngân hàng", "cổ phiếu VN30", "Xu hướng kinh tế", "Tin"], "tags": ["chứng khoán việt nam", "cổ phiếu ngân hàng", "cổ phiếu vn30"]}
